{
  "schema_version": "1.0",
  "commit_intent_id": "01j4w4j9a3jpsk9r7jcrg29q01",
  "job_id": "01j4w4hy5kd6zmx4pc4k2xv7br",
  "attempt_id": "01j4w4j0k7hm9j9tx3jz8s2n5q",
  "intent_kind": "page_version",
  "idempotency_key": "page-version:01j4w4j7mr6c9s7cezz9n5f2qp",
  "state": "prepared",
  "staging_relative_path": "staging/01j4w4j9a3jpsk9r7jcrg29q01",
  "final_relative_path": "pages/example.org/01j4w4j6v2v4p84n8v7v60m0s7/versions/01j4w4j7mr6c9s7cezz9n5f2qp",
  "manifest_sha256": "cccccccccccccccccccccccccccccccccccccccccccccccccccccccccccccccc",
  "expected_files": [
    {
      "relative_path": "page.md",
      "sha256": "aaaaaaaaaaaaaaaaaaaaaaaaaaaaaaaaaaaaaaaaaaaaaaaaaaaaaaaaaaaaaaaa",
      "size_bytes": 142
    },
    {
      "relative_path": "record.json",
      "sha256": "bbbbbbbbbbbbbbbbbbbbbbbbbbbbbbbbbbbbbbbbbbbbbbbbbbbbbbbbbbbbbbbb",
      "size_bytes": 640
    }
  ],
  "recovery_count": 0,
  "created_at": "2026-08-09T12:00:01Z",
  "updated_at": "2026-08-09T12:00:01Z"
}
